{
  "$schema": "../../schemas/course.schema.json",
  "id": "course:security-awareness-training",
  "title": "Security Awareness Training",
  "description": "🚨 REQUIRED: Annual security awareness training for all team members",
  "version": "1.0.0",
  "level": "beginner",
  "estimatedHours": 2,
  "tags": ["security", "compliance", "required", "annual"],
  "prerequisites": [],
  "outcomes": [
    "Identify common security threats (phishing, social engineering, malware)",
    "Follow security best practices for passwords and authentication",
    "Recognize and report security incidents",
    "Understand data handling and privacy requirements",
    "Apply security principles in daily work"
  ],
  "modules": [
    {
      "id": "module:security-threats",
      "title": "Common Security Threats",
      "description": "Identifying and avoiding security threats",
      "lessons": [
        "lesson:phishing-awareness",
        "lesson:social-engineering",
        "lesson:malware-protection"
      ],
      "assessment": "assessment:security-threats-quiz"
    },
    {
      "id": "module:security-practices",
      "title": "Security Best Practices",
      "description": "Essential security practices for everyone",
      "lessons": [
        "lesson:password-security",
        "lesson:data-handling",
        "lesson:incident-response"
      ],
      "assessment": "assessment:security-practices-quiz"
    }
  ],
  "metadata": {
    "author": "BlackRoad OS Security Team",
    "createdAt": "2025-11-25T00:00:00Z",
    "updatedAt": "2025-11-25T00:00:00Z",
    "complianceCategory": "security-training",
    "archiveRequired": true,
    "certificateRequired": true,
    "requiredTraining": true,
    "renewalPeriodMonths": 12
  }
}
